{
  "schema": "governance-distribution-manifest/v1",
  "distribution_version": "0.1.0",
  "governance_version": "1.0.0",
  "checker_version": "0.1.0",
  "source_commit": "UNCOMMITTED",
  "artifacts": [
    {
      "path": "core/SPEC.md",
      "class": "NORMATIVE",
      "ownership": "UPSTREAM_OWNED",
      "sha256": "664fb4b6930b44e407c60bce60df27fe2926ff5dc2d8aff7fb688e69e6c60d18"
    },
    {
      "path": "core/schemas/decision-v1.md",
      "class": "NORMATIVE",
      "ownership": "UPSTREAM_OWNED",
      "sha256": "7df1d367128eac810088bc8864e6a132ecfcf2008fee9ad12e2bc637493f0b59"
    },
    {
      "path": "core/schemas/constraint-v1.md",
      "class": "NORMATIVE",
      "ownership": "UPSTREAM_OWNED",
      "sha256": "29a61a5f13797cb62a1537394d6254d530abab18fbb602ea001a9302c6daa218"
    },
    {
      "path": "core/schemas/open-question-v1.md",
      "class": "NORMATIVE",
      "ownership": "UPSTREAM_OWNED",
      "sha256": "a3dc66e08b3c6d043437c528e597ee7d04761fb2f3c57e16b187756e4ebce5c2"
    },
    {
      "path": "core/schemas/task-v1.md",
      "class": "NORMATIVE",
      "ownership": "UPSTREAM_OWNED",
      "sha256": "68494ff47cbb1283c451b2826ce668108ae1ec88ac5a8234b588a6f61b739ba0"
    },
    {
      "path": "core/schemas/state-v1.md",
      "class": "NORMATIVE",
      "ownership": "UPSTREAM_OWNED",
      "sha256": "40f63ba206e94ddcb2832491bc5b54552399ec2d254fd5338183973689979778"
    },
    {
      "path": "template/AGENTS.md",
      "class": "TEMPLATE",
      "ownership": "MIXED",
      "sha256": "0ee3ce54aab4374c0ccd2b849bb0bf45555e11bad384485de336806bff0f5dc6"
    },
    {
      "path": "template/governance/manifest.yaml",
      "class": "TEMPLATE",
      "ownership": "MIXED",
      "sha256": "923d0cf3e043c04a814f7dbe8c8c8fe64f7493701ed827a23112ca6a8be1a6a0"
    },
    {
      "path": "template/governance/SPEC.md",
      "class": "TEMPLATE",
      "ownership": "UPSTREAM_OWNED",
      "sha256": "664fb4b6930b44e407c60bce60df27fe2926ff5dc2d8aff7fb688e69e6c60d18"
    },
    {
      "path": "template/governance/schemas/decision-v1.md",
      "class": "TEMPLATE",
      "ownership": "UPSTREAM_OWNED",
      "sha256": "7df1d367128eac810088bc8864e6a132ecfcf2008fee9ad12e2bc637493f0b59"
    },
    {
      "path": "template/governance/schemas/constraint-v1.md",
      "class": "TEMPLATE",
      "ownership": "UPSTREAM_OWNED",
      "sha256": "29a61a5f13797cb62a1537394d6254d530abab18fbb602ea001a9302c6daa218"
    },
    {
      "path": "template/governance/schemas/open-question-v1.md",
      "class": "TEMPLATE",
      "ownership": "UPSTREAM_OWNED",
      "sha256": "a3dc66e08b3c6d043437c528e597ee7d04761fb2f3c57e16b187756e4ebce5c2"
    },
    {
      "path": "template/governance/schemas/task-v1.md",
      "class": "TEMPLATE",
      "ownership": "UPSTREAM_OWNED",
      "sha256": "68494ff47cbb1283c451b2826ce668108ae1ec88ac5a8234b588a6f61b739ba0"
    },
    {
      "path": "template/governance/schemas/state-v1.md",
      "class": "TEMPLATE",
      "ownership": "UPSTREAM_OWNED",
      "sha256": "40f63ba206e94ddcb2832491bc5b54552399ec2d254fd5338183973689979778"
    },
    {
      "path": "template/tooling/governance/check.mjs",
      "class": "TOOLING",
      "ownership": "UPSTREAM_OWNED",
      "sha256": "8724f8ac5e6e2346922b93fb4de2ac599b2fb94ee43cb3b71dbf11d964b19075"
    },
    {
      "path": "template/tooling/governance/version.json",
      "class": "TOOLING",
      "ownership": "UPSTREAM_OWNED",
      "sha256": "f527b73892749bfb8dfb48e0297f97cd92afa292ee66b298ebe07965c95060cf"
    },
    {
      "path": "tooling/init/init.mjs",
      "class": "TOOLING",
      "ownership": "UPSTREAM_OWNED",
      "sha256": "b2ce26f62f2fd3a00f6882e76d173d12c1de9320bf48e58fed9d1641a39ed1bc"
    },
    {
      "path": "adoption/GREENFIELD.md",
      "class": "GUIDANCE",
      "ownership": "UPSTREAM_OWNED",
      "sha256": "b90d05e7424b0cb2ed63768107ab7169237cb721945b39a4aa5c3ccb4c7985c3"
    },
    {
      "path": "adoption/BROWNFIELD.md",
      "class": "GUIDANCE",
      "ownership": "UPSTREAM_OWNED",
      "sha256": "cc99ebbafad1afcfc5267fd53c8cd5a0982322128b770849b0dda36199d53411"
    },
    {
      "path": "adoption/FINAL-AUDIT.md",
      "class": "GUIDANCE",
      "ownership": "UPSTREAM_OWNED",
      "sha256": "926dca36031ceef88b0e530d3f03f662b693c91598a83d9a40bc15e307e0abe6"
    },
    {
      "path": "adoption/UPGRADE.md",
      "class": "GUIDANCE",
      "ownership": "UPSTREAM_OWNED",
      "sha256": "318f6f313f040ef85c0bb9700781c6b2f460273ecbb24aa147a1d2596c5a0ea1"
    }
  ]
}
